,Date,Day,Territory,Menu Item,Price (HKD),Price (USD),Category,Menu
1,2023/08/02,Wed,Hong Kong,Refreshing Breakfast Combo for 1,45.00,5.77,New Sharing Meals,Breakfast Menu
2,2023/08/02,Wed,Hong Kong,Refreshing Breakfast Combo for 2,90.00,11.55,New Sharing Meals,Breakfast Menu
3,2023/08/02,Wed,Hong Kong,Happy Family Breakfast Combo,99.00,12.70,New Sharing Meals,Breakfast Menu
4,2023/08/02,Wed,Hong Kong,Refreshing Breakfast Combo for 3,119.00,15.27,New Sharing Meals,Breakfast Menu
5,2023/08/02,Wed,Hong Kong,McCafe Refreshing Breakfast Combo for 3,143.00,18.35,McCafe Value Combo,Breakfast Menu
6,2023/08/02,Wed,Hong Kong,McCafe Refreshing Breakfast Combo for 2,106.00,13.60,McCafe Value Combo,Breakfast Menu
7,2023/08/02,Wed,Hong Kong,McCafe Refreshing Breakfast Combo for 1,53.00,6.80,McCafe Value Combo,Breakfast Menu
8,2023/08/02,Wed,Hong Kong,McCafe Happy Family Breakfast Combo,115.00,14.76,McCafe Value Combo,Breakfast Menu
9,2023/08/02,Wed,Hong Kong,Pollock Filet Deluxe Breakfast,36.50,4.68,Breakfast A-la-carte,Breakfast Menu
10,2023/08/02,Wed,Hong Kong,Scrambled Eggs Burger,20.50,2.63,Breakfast A-la-carte,Breakfast Menu
11,2023/08/02,Wed,Hong Kong,Scrambled Eggs N' Chicken Burger,24.50,3.14,Breakfast A-la-carte,Breakfast Menu
12,2023/08/02,Wed,Hong Kong,Scrambled Eggs N' Ham Burger,24.50,3.14,Breakfast A-la-carte,Breakfast Menu
13,2023/08/02,Wed,Hong Kong,NEW LUNCHEON Meat N' Scrambled Egg Burger,26.50,3.40,Breakfast A-la-carte,Breakfast Menu
14,2023/08/02,Wed,Hong Kong,NEW LUNCHEON Meat McMuffin with Egg,26.50,3.40,Breakfast A-la-carte,Breakfast Menu
15,2023/08/02,Wed,Hong Kong,Jumbo Breakfast,36.00,4.62,Breakfast A-la-carte,Breakfast Menu
16,2023/08/02,Wed,Hong Kong,Deluxe Breakfast,31.50,4.04,Breakfast A-la-carte,Breakfast Menu
17,2023/08/02,Wed,Hong Kong,Hotcakes Deluxe Breakfast,31.50,4.04,Breakfast A-la-carte,Breakfast Menu
18,2023/08/02,Wed,Hong Kong,Sausage McMuffin® with Egg,24.50,3.14,Breakfast A-la-carte,Breakfast Menu
19,2023/08/02,Wed,Hong Kong,Filet-O-Fish™,24.00,3.08,Breakfast A-la-carte,Breakfast Menu
20,2023/08/02,Wed,Hong Kong,Hotcakes (3 pcs),21.50,2.76,Breakfast A-la-carte,Breakfast Menu
21,2023/08/02,Wed,Hong Kong,Sausage N' Egg Twisty Pasta (Tonkotsu Flavor),30.50,3.91,Breakfast A-la-carte,Breakfast Menu
22,2023/08/02,Wed,Hong Kong,Ham N' Egg Twisty Pasta (Tonkotsu Flavor),30.50,3.91,Breakfast A-la-carte,Breakfast Menu
23,2023/08/02,Wed,Hong Kong,Grilled Chicken Twisty Pasta with Egg (Tonkotsu Flavor),35.50,4.56,Breakfast A-la-carte,Breakfast Menu
24,2023/08/02,Wed,Hong Kong,Chicken and Egg Burger,24.50,3.14,Breakfast A-la-carte,Breakfast Menu
25,2023/08/02,Wed,Hong Kong,Happy Meal® Filet-O-Fish™,38.00,4.88,Happy Meal,Breakfast Menu
26,2023/08/02,Wed,Hong Kong,Happy Meal® Hotcakes (2pcs),33.50,4.30,Happy Meal,Breakfast Menu
27,2023/08/02,Wed,Hong Kong,Other Happy Meal Set,29.50,3.79,Happy Meal,Breakfast Menu
28,2023/08/02,Wed,Hong Kong,Iced Latte,40.00,5.13,McCafe Drink for McDelivery. (Coffee brewed with 3.7 Fresh Milk),Breakfast Menu
29,2023/08/02,Wed,Hong Kong,Iced Cappuccino,40.00,5.13,McCafe Drink for McDelivery. (Coffee brewed with 3.7 Fresh Milk),Breakfast Menu
30,2023/08/02,Wed,Hong Kong,Iced Americano,40.00,5.13,McCafe Drink for McDelivery. (Coffee brewed with 3.7 Fresh Milk),Breakfast Menu
31,2023/08/02,Wed,Hong Kong,Iced Crunchy Ovaltine®,40.00,5.13,McCafe Drink for McDelivery. (Coffee brewed with 3.7 Fresh Milk),Breakfast Menu
32,2023/08/02,Wed,Hong Kong,Cappuccino(L),35.00,4.49,McCafe Drink for McDelivery. (Coffee brewed with 3.7 Fresh Milk),Breakfast Menu
33,2023/08/02,Wed,Hong Kong,Latte(L),35.00,4.49,McCafe Drink for McDelivery. (Coffee brewed with 3.7 Fresh Milk),Breakfast Menu
34,2023/08/02,Wed,Hong Kong,Americano(L),35.00,4.49,McCafe Drink for McDelivery. (Coffee brewed with 3.7 Fresh Milk),Breakfast Menu
35,2023/08/02,Wed,Hong Kong,Crunchy Ovaltine(L),35.00,4.49,McCafe Drink for McDelivery. (Coffee brewed with 3.7 Fresh Milk),Breakfast Menu
36,2023/08/02,Wed,Hong Kong,Minute Maid® Orange Juice (XL),19.50,2.50,Beverages ',Breakfast Menu
37,2023/08/02,Wed,Hong Kong,Coca-Cola® (L),18.00,2.31,Beverages ',Breakfast Menu
38,2023/08/02,Wed,Hong Kong,Sprite® Lemon- Lime Flavoured Soda (L),18.00,2.31,Beverages ',Breakfast Menu
39,2023/08/02,Wed,Hong Kong,Fanta® Orange Flavoured Soda (L),18.00,2.31,Beverages ',Breakfast Menu
40,2023/08/02,Wed,Hong Kong,Coca-Cola® No Sugar (L),18.00,2.31,Beverages ',Breakfast Menu
41,2023/08/02,Wed,Hong Kong,Iced Prem Roast Coffee (L),24.00,3.08,Beverages ',Breakfast Menu
42,2023/08/02,Wed,Hong Kong,Hot Chocolate,18.00,2.31,Beverages ',Breakfast Menu
43,2023/08/02,Wed,Hong Kong,Hi-Calcium Low Fat Milk Drink,18.50,2.37,Beverages ',Breakfast Menu
44,2023/08/02,Wed,Hong Kong,Hot Local Milk Tea  (L),19.50,2.50,Beverages ',Breakfast Menu
45,2023/08/02,Wed,Hong Kong,Ground Coffee (L),21.50,2.76,Beverages ',Breakfast Menu
46,2023/08/02,Wed,Hong Kong,Iced Local Milk Tea (L),23.00,2.95,Beverages ',Breakfast Menu
47,2023/08/02,Wed,Hong Kong,Iced Fresh Lemon Tea (L),23.00,2.95,Beverages ',Breakfast Menu
48,2023/08/02,Wed,Hong Kong,Hot Fresh Lemon Tea (L),19.50,2.50,Beverages ',Breakfast Menu
49,2023/08/02,Wed,Hong Kong,Hash Browns,16.00,2.05,Extra,Breakfast Menu
50,2023/08/02,Wed,Hong Kong,Hotcake Syrup,1.00,0.13,Extra,Breakfast Menu
51,2023/08/02,Wed,Hong Kong,Skippy Peanut Butter,1.00,0.13,Extra,Breakfast Menu
52,2023/08/02,Wed,Hong Kong,Sweetened Creamer,1.00,0.13,Extra,Breakfast Menu
53,2023/08/02,Wed,Hong Kong,Hi-Calcium Low Fat Blueberry Yoghurt,16.00,2.05,Extra,Breakfast Menu
54,2023/08/02,Wed,Hong Kong,Fresh Corn Cup (Jumbo),22.50,2.89,Extra,Breakfast Menu
